,date,content,sentiment,traffic_class,place
167,2023-02-14 17:08:25+00:00,Traffic is busy now at kudirat abiola way from Ojota to welfare and Ikosi junction. ,Positive,heavy traffic,"['kudirat abiola way', 'Ojota', 'welfare']"
168,2023-02-14 19:13:17+00:00,"A loaded truck has broken down with mechanical fault on Iyanaipaja-Ayobo road, after Kokumo bus stop, inward Moshalasi r/bout",Negative,breakdown,['Iyanaipaja-Ayobo road']
169,2023-02-15 06:05:13+00:00,An accident involving a container laden truck and a Tanker has occurred on the Alaka bridge inw Eko bridge,Negative,accident,['Alaka bridge']
170,2023-02-15 06:35:16+00:00,"A truck has broken down at Eleko jnctn inw Epe, taking up a lane.",Negative,breakdown,"['Eleko jnctn', 'Epe']"
171,2023-02-15 06:46:46+00:00,"Traffic is gd from Sango inw Ajegunle, Alakuko, Moshalashi, Kola, Casso, Adura, Salolo, Meiran, Ijaiye, Obadeyi thru Ahmadiya and Abule Egba via the bridge and under the bridge.",Positive,free flow,"['Sango', 'Ajegunle', 'Alakuko', 'Moshalashi,', 'Kola', 'Casso,']"
172,2023-02-15 06:46:48+00:00,"Traffic is still gd inw Katangua, Super, Ile-Epo, Pleasure, Danco and Iyana Ipaja.",Positive,free flow,"['Katangua', 'Ile-Epo']"
173,2023-02-15 06:46:48+00:00,"Moving on thru Araromi, Adealu, Paki and Iyana Dopemu inw Dopemu, Cement, Mangoro, Ile Zik and Ikeja Along is gd.",Positive,free flow,"['Araromi', 'Adealu', 'Ile Zik']"
174,2023-02-15 07:24:24+00:00,"A container laden trailer has broken down at Conoil U-turn inw Igando Phase 1,",Positive,breakdown,"['Conoil', 'Igando Phase 1']"
175,2023-02-15 07:30:44+00:00,"A loaded tanker has broken down at Abule Tailor inw Ijaiye, taking up a lane. ",Negative,breakdown,['Abule Tailor']
176,2023-02-15 07:42:31+00:00,"Traffic gd from Ajuwon Rd inw Elliot, Rogo Jnctn approaching Ishaga R/Abt.",Positive,free flow,"['Ajuwon Rd', 'Elliot', 'Rogo', 'Ishaga']"
177,2023-02-15 08:11:37+00:00,A multiple accident has occurred at Ijaiye inw Abule Egba due to break failure.,Positive,breakdown,['Ijaiye']
178,2023-02-15 10:57:33+00:00,"A truck has broken down just by Mosley B/Stop on Gerard Rd inw Gerard R/Abt, taking up a lane thereby slowing down traffic",Negative,heavy traffic,['Mosley B/Stop']
179,2023-02-15 11:35:53+00:00,"The earlier reported broken down truck on Gerard road inw the Gerard R/Abt has been towed off the spot,",Negative,breakdown,[]
180,2023-02-15 11:37:12+00:00,The earlier reported broken down truck at Ebute Police post intersection has been towed off the road,Negative,breakdown,['Ebute Police post']
181,2023-02-15 16:58:31+00:00,Ogba is slightly busy due to bstop activities and influx into Thomas Salako,Positive,heavy traffic,['Ogba']
182,2023-02-15 17:03:50+00:00,"Eleganza down to Etisalat, Mr Biggs to connect Wharf gate is good.  ",Positive,free flow,"['Eleganza', 'Etisalat', 'Mr Biggs', 'Wharf gate']"
183,2023-02-16 05:55:38+00:00,Early morning rush out of Apapa through the Marine bridge to connect Iganmu and Ijora is also good to go.  ,Positive,free flow,['Apapa']
184,2023-02-16 06:00:34+00:00,"For now we are still enjoying free flow of traffic inward and outward of Carter bridge , while traffic from underneath ldumota bridge inward Eyin Eyo connecting Balogun is also street still looking good at this hour.",Positive,free flow,"['For', 'Carter bridge', 'ldumota bridge', 'Eyin Eyo']"
185,2023-02-16 06:00:35+00:00,Tinubu connecting Nnamdi Azikiwe street enroute Tom Jones intersection is equally good to go for now,Positive,free flow,['Tinubu']
186,2023-02-16 06:05:19+00:00,The return journey from Marwa back to Ajah is also good to go.,Positive,free flow,['Marwa']
187,2023-02-16 08:31:53+00:00,Evacuation is presently ongoing at the earlier reported accident scene at Igboefon,Positive,breakdown,['Evacuation']
188,2023-02-16 09:18:38+00:00,Movement from Odo Ogun down to Mile 12 is good to go.,Positive,free flow,"['Odo Ogun', 'Mile 12']"
189,2023-02-16 09:18:38+00:00,Ascending and descending Mile 12 inward kosofe down to Iyana School is good to go.,Positive,free flow,['Mile 12']
